{"schema":"tablet-layout-observation\/v2","run_id":"tl1-c1a-20260826t114535z-63667b68ce4f","captured_at":"2026-08-26T11:46:02.2420830Z","mode":"diagnostic_only","provenance":{"kind":"gateway_runtime_probe","name":"tablet-c1a-provider","version":"v1","producer_commit_sha":"2635fc9f5eb229340870b0cdd599cefad97a9b91","producer_artifact_sha256":"sha256:a8050c11f31bd7deeb30abe69c81c0efc727fc5d7a9d695b96a1f1d2a8e50839","runtime_attested":false},"upstream_t0":{"source_kind":"trusted_runtime","schema_version":5,"run_id":"tl1-c1a-20260826t114535z-63667b68ce4f","captured_at":"2026-08-26T11:45:57.8293489Z","artifact_sha256":"sha256:f9d548f0b0ae3ccb329ae40b0a784aba884a901e7c61f4dfbe6432b1b8912079","producer_commit_sha":"4ca32b131007df58f7752c5ee9b2d049cb1cd54e","device_profile_hash":"sha256:b52f929e226a49768042428dad1495e8e79acf770b4bad78c7ff3abbac045349","intake_status":"accepted","readiness_status":"blocked","readiness_reasons":["orientation_unknown","aspect_unknown","capture_consistency_unknown","application_window_count_not_one","visible_window_type_unknown","window_field_malformed","focus_absent"],"p0_capability":"unsupported","p0_unsupported_reasons":["orientation_unknown","aspect_unknown","capture_consistency_unknown","application_window_count_not_one","visible_window_type_unknown","window_field_malformed","focus_absent","wechat_layout_unverified","tablet_landscape_p0_unimplemented"]},"route":{"kind":"probe_only","settings_mutation_allowed":false,"device_action_allowed":false},"privacy":{"hash_algorithm":"sha256","raw_window_identity_persisted":false,"raw_node_identity_persisted":false,"chat_plaintext_persisted":false,"raw_screenshot_persisted":false,"raw_dump_persisted":false,"whole_screen_ocr_persisted":false},"frames":[{"capture_id":"capture-c1","captured_at":"2026-08-26T11:46:00.2597790Z","capture":{"token":"c1","revision_before":15,"revision_after":15,"layout_revision":15,"ime_revision":15},"display":{"display_id_status":"known","display_id":0,"effective_size":{"width":2800,"height":1968},"orientation":"landscape"},"a11y_windows":[{"window_label":"aw1","identity_namespace":"a11y_run_local","display_id":0,"type":"application","root_package":"com.tencent.mm","layer":0,"bounds":{"left":0,"top":0,"right":985,"bottom":1968},"touchable_bounds":{"left":0,"top":0,"right":985,"bottom":1968},"root_status":"readable","active":false,"focused":false},{"window_label":"aw2","identity_namespace":"a11y_run_local","display_id":0,"type":"application","root_package":"com.tencent.mm","layer":1,"bounds":{"left":989,"top":0,"right":2800,"bottom":1968},"touchable_bounds":{"left":989,"top":0,"right":2800,"bottom":1968},"root_status":"readable","active":true,"focused":true},{"window_label":"aw3","identity_namespace":"a11y_run_local","display_id":0,"type":"system","root_package":"com.android.systemui","layer":3,"bounds":{"left":0,"top":0,"right":2800,"bottom":95},"touchable_bounds":{"left":0,"top":0,"right":2800,"bottom":95},"root_status":"readable","active":false,"focused":false},{"window_label":"aw4","identity_namespace":"a11y_run_local","display_id":0,"type":"system","root_package":"com.vivo.upslide","layer":4,"bounds":{"left":0,"top":1923,"right":2800,"bottom":1968},"touchable_bounds":{"left":0,"top":1923,"right":2800,"bottom":1968},"root_status":"readable","active":false,"focused":false},{"window_label":"aw5","identity_namespace":"a11y_run_local","display_id":0,"type":"unknown","root_package":"android","layer":2,"bounds":{"left":942,"top":879,"right":1032,"bottom":1089},"touchable_bounds":{"left":942,"top":879,"right":1032,"bottom":1089},"root_status":"readable","active":false,"focused":false}],"windows_truncated":false,"panes":[{"pane_label":"ap1","window_label":"aw1","role":"unknown","bounds":{"left":0,"top":0,"right":985,"bottom":1968},"binding":"root_subtree"},{"pane_label":"ap2","window_label":"aw2","role":"unknown","bounds":{"left":989,"top":0,"right":2800,"bottom":1968},"binding":"root_subtree"}],"panes_truncated":false,"node_observations":[{"node_label":"an1","window_label":"aw1","pane_label":"ap1","role":"other","bounds":{"left":0,"top":0,"right":0,"bottom":0},"visible":false,"enabled":false,"clickable":false,"long_clickable":false,"editable":false,"scrollable":false,"checkable":false,"focused":false},{"node_label":"an2","window_label":"aw2","pane_label":"ap2","role":"other","bounds":{"left":0,"top":0,"right":0,"bottom":0},"visible":false,"enabled":false,"clickable":false,"long_clickable":false,"editable":false,"scrollable":false,"checkable":false,"focused":false}],"nodes_truncated":false,"target":{"expected_title_hash":"sha256:5d3510ec998c991305fcede15b32be9ea1c4061d82ab15a3994a38faa243311c","conversation_window_label":null,"conversation_pane_label":null,"title_candidates":[],"toolbar_candidates":[],"message_candidates":[],"input_candidates":[],"focus":{"status":"unknown","window_label":null,"input_candidate_label":null},"ime":{"visible":false,"mode":"none","bounds":null,"editor_fingerprint_hash":null,"binding":"not_active","target_input_candidate_label":null,"capture_token":"c1"}}},{"capture_id":"capture-c2","captured_at":"2026-08-26T11:46:02.2420830Z","capture":{"token":"c2","revision_before":15,"revision_after":15,"layout_revision":15,"ime_revision":15},"display":{"display_id_status":"known","display_id":0,"effective_size":{"width":2800,"height":1968},"orientation":"landscape"},"a11y_windows":[{"window_label":"aw1","identity_namespace":"a11y_run_local","display_id":0,"type":"application","root_package":"com.tencent.mm","layer":0,"bounds":{"left":0,"top":0,"right":985,"bottom":1968},"touchable_bounds":{"left":0,"top":0,"right":985,"bottom":1968},"root_status":"readable","active":false,"focused":false},{"window_label":"aw2","identity_namespace":"a11y_run_local","display_id":0,"type":"application","root_package":"com.tencent.mm","layer":1,"bounds":{"left":989,"top":0,"right":2800,"bottom":1968},"touchable_bounds":{"left":989,"top":0,"right":2800,"bottom":1968},"root_status":"readable","active":true,"focused":true},{"window_label":"aw3","identity_namespace":"a11y_run_local","display_id":0,"type":"system","root_package":"com.android.systemui","layer":3,"bounds":{"left":0,"top":0,"right":2800,"bottom":95},"touchable_bounds":{"left":0,"top":0,"right":2800,"bottom":95},"root_status":"readable","active":false,"focused":false},{"window_label":"aw4","identity_namespace":"a11y_run_local","display_id":0,"type":"system","root_package":"com.vivo.upslide","layer":4,"bounds":{"left":0,"top":1923,"right":2800,"bottom":1968},"touchable_bounds":{"left":0,"top":1923,"right":2800,"bottom":1968},"root_status":"readable","active":false,"focused":false},{"window_label":"aw5","identity_namespace":"a11y_run_local","display_id":0,"type":"unknown","root_package":"android","layer":2,"bounds":{"left":942,"top":879,"right":1032,"bottom":1089},"touchable_bounds":{"left":942,"top":879,"right":1032,"bottom":1089},"root_status":"readable","active":false,"focused":false}],"windows_truncated":false,"panes":[{"pane_label":"ap1","window_label":"aw1","role":"unknown","bounds":{"left":0,"top":0,"right":985,"bottom":1968},"binding":"root_subtree"},{"pane_label":"ap2","window_label":"aw2","role":"unknown","bounds":{"left":989,"top":0,"right":2800,"bottom":1968},"binding":"root_subtree"}],"panes_truncated":false,"node_observations":[{"node_label":"an1","window_label":"aw1","pane_label":"ap1","role":"other","bounds":{"left":0,"top":0,"right":0,"bottom":0},"visible":false,"enabled":false,"clickable":false,"long_clickable":false,"editable":false,"scrollable":false,"checkable":false,"focused":false},{"node_label":"an2","window_label":"aw2","pane_label":"ap2","role":"other","bounds":{"left":0,"top":0,"right":0,"bottom":0},"visible":false,"enabled":false,"clickable":false,"long_clickable":false,"editable":false,"scrollable":false,"checkable":false,"focused":false}],"nodes_truncated":false,"target":{"expected_title_hash":"sha256:5d3510ec998c991305fcede15b32be9ea1c4061d82ab15a3994a38faa243311c","conversation_window_label":null,"conversation_pane_label":null,"title_candidates":[],"toolbar_candidates":[],"message_candidates":[],"input_candidates":[],"focus":{"status":"unknown","window_label":null,"input_candidate_label":null},"ime":{"visible":false,"mode":"none","bounds":null,"editor_fingerprint_hash":null,"binding":"not_active","target_input_candidate_label":null,"capture_token":"c2"}}}],"consistency":{"sample_count":2,"minimum_interval_ms":1982,"stable":false,"reason_codes":["capture_order_invalid"]},"diagnostic_status":"blocked","reason_codes":["capture_order_invalid","focus_fallback_insufficient","focus_target_conflict","node_binding_invalid","region_candidate_missing","target_title_not_unique","target_window_pane_missing","window_pane_bijection_invalid"],"layout_accepted":false,"wechat_layout_verified":false,"editor_action_ready":false,"p0_capability":"unsupported","p0_blockers":["tablet_layout_diagnostic_only","upstream_t0_readiness_blocked","tablet_landscape_p0_unimplemented","tablet_tl2_unverified"],"execution_grant":false}